{
  "artifact_operation_id": "aop_preview_01J000000000000000000",
  "operation_kind": "preview",
  "tenant_id": "ten_01J00000000000000000000000",
  "client_app_id": "html-product",
  "principal_context_digest": "sha256:bfb1d517260890b1df9744f3b1420dda3865f1a382e9735ecbeb895bbc8e5862",
  "artifact_id": "art_01J00000000000000000000000",
  "source_version_id": "ver_01J00000000000000000000000",
  "source_version_digest": "sha256:8f849c3f87818d7b11c3de39155576cb941f7157d73daf22162fa996b58ee919",
  "request_digest": "sha256:a4ef0fb82260822297ca0095e25cb26d732e5a8494c680a8f0761f5e8cc87c4a",
  "invocation_request_digest": "sha256:8c0e799920cf80586dfe76073788705cd45948946af4a768ad69f85af1e1fd02",
  "commercial_authorization_id": "cauth_01J00000000000000000000000",
  "commercial_authorization_digest": "sha256:4db7c70af758d395510dddfeeb64901afd74c4b8a1fd6d3421ad19314b12f69e",
  "quota_reservation_id": "qres_01J00000000000000000000000",
  "quota_reservation_digest": "sha256:7373737373737373737373737373737373737373737373737373737373737373",
  "policy_decision_id": "pol_preview_01J000000000000000000",
  "policy_decision_digest": "sha256:650e381596cb9ecd0d3b239b7514c8b55ff2034922bf8a522b23c2365841df8f",
  "execution_budget_id": "bud_preview_01J000000000000000000",
  "execution_budget_digest": "sha256:058abfaeca0cf57ba346cef5a301bd0512b525f5131d8ee432776be58f7be491",
  "effective_permissions_id": "perm_preview_01J00000000000000000",
  "effective_permissions_digest": "sha256:4b628137b325089843ba19eb9ccbb7d6d1b23ac5a119abeaf4e2fe15315af3eb",
  "artifact_gateway_binding_digest": "sha256:33647b3a7c5cb44be525b29b7c3c405b72238760f11ab8e5ff2ea9ddae1cc4a6",
  "provider_resolution_id": "res_preview_01J000000000000000000",
  "provider_revision_id": "rpr_01J00000000000000000000000",
  "invocation_id": "inv_preview_01J000000000000000000",
  "status": "succeeded",
  "state_version": 5,
  "terminal_stage": "finalization",
  "result_reference": "artifact-operation-result://aop_preview_01J000000000000000000",
  "terminal_evidence_digest": "sha256:2328ea766e6d2ada3a4c84ff8d0a70e1099a48bc6af581bfb5f8dd6779c345cb",
  "created_at": "2026-07-16T09:06:00Z",
  "updated_at": "2026-07-16T09:06:05Z",
  "completed_at": "2026-07-16T09:06:05Z"
}
